{
  "enrollments": [
    {
      "auditLine": 34,
      "axiomTrust": "flagged",
      "axioms": [
        "Classical.choice",
        "Quot.sound",
        "propext",
        "sorryAx"
      ],
      "claimKind": "logical-relation",
      "claimRole": "canonical",
      "claimStrength": "partial",
      "definitionSource": {
        "line": 267,
        "path": "Bang/Spec.lean"
      },
      "evidenceKind": "partial-kernel-declaration",
      "guarantee": "Partial logical-relation adequacy from related computations to typed contextual approximation.",
      "id": "bang-lr-sound",
      "limitations": [
        "Depends on sorryAx at the documented capability-reshape observation bridge."
      ],
      "premiseUsage": {
        "loadBearing": [
          "step-indexed Crel premise"
        ],
        "unused": []
      },
      "reportName": "Bang.lr_sound",
      "scope": "Typed source computations at one effect and computation type.",
      "specHeadline": true,
      "statementShape": "(forall n, Crel n B e c1 c2) -> ctxApprox c1 c2",
      "targetModelKind": "typed-contextual-semantics",
      "writtenRef": "lr_sound"
    },
    {
      "auditLine": 35,
      "axiomTrust": "flagged",
      "axioms": [
        "Classical.choice",
        "Quot.sound",
        "propext",
        "sorryAx"
      ],
      "claimKind": "logical-relation",
      "claimRole": "canonical",
      "claimStrength": "partial",
      "definitionSource": {
        "line": 298,
        "path": "Bang/Spec.lean"
      },
      "evidenceKind": "partial-kernel-declaration",
      "guarantee": "Partial fundamental theorem for related closures of a typed open computation.",
      "id": "bang-lr-fundamental",
      "limitations": [
        "Depends on sorryAx in the handler and up compatibility spine."
      ],
      "premiseUsage": {
        "loadBearing": [
          "source typing",
          "related closing environments"
        ],
        "unused": []
      },
      "reportName": "Bang.lr_fundamental",
      "scope": "Step-indexed binary logical relation over typed source terms.",
      "specHeadline": true,
      "statementShape": "HasCTy gamma Gamma c e B -> forall n delta1 delta2, EnvRel n Gamma delta1 delta2 -> Crel n B e (closeC delta1 c) (closeC delta2 c)",
      "targetModelKind": "typed-contextual-semantics",
      "writtenRef": "lr_fundamental"
    },
    {
      "auditLine": 36,
      "axiomTrust": "flagged",
      "axioms": [
        "Classical.choice",
        "Quot.sound",
        "propext",
        "sorryAx"
      ],
      "claimKind": "logical-relation",
      "claimRole": "supporting",
      "claimStrength": "partial",
      "definitionSource": {
        "line": 308,
        "path": "Bang/Spec.lean"
      },
      "evidenceKind": "partial-kernel-declaration",
      "guarantee": "Closed-program specialization of the partial logical-relation fundamental theorem.",
      "id": "bang-lr-fundamental-closed",
      "limitations": [
        "Inherits the sorryAx dependencies of lr_fundamental and is not independent evidence."
      ],
      "premiseUsage": {
        "loadBearing": [
          "closed source typing"
        ],
        "unused": []
      },
      "reportName": "Bang.lr_fundamental_closed",
      "scope": "Closed typed source computations.",
      "specHeadline": true,
      "statementShape": "HasCTy gamma [] c e B -> forall n, Crel n B e c c",
      "targetModelKind": "typed-contextual-semantics",
      "writtenRef": "lr_fundamental_closed"
    },
    {
      "auditLine": 38,
      "axiomTrust": "trusted",
      "axioms": [
        "Classical.choice",
        "Quot.sound",
        "propext"
      ],
      "claimKind": "contextual-equivalence-law",
      "claimRole": "canonical",
      "claimStrength": "strong",
      "definitionSource": {
        "line": 324,
        "path": "Bang/Spec.lean"
      },
      "evidenceKind": "kernel-checked-theorem",
      "guarantee": "Returning a value and then sequencing is contextually equivalent to the continuation.",
      "id": "bang-seq-unit",
      "limitations": [
        "A single sequencing law, not a complete equational theory."
      ],
      "premiseUsage": {
        "loadBearing": [],
        "unused": []
      },
      "reportName": "Bang.seq_unit",
      "scope": "Every typed observation effect and computation type.",
      "specHeadline": true,
      "statementShape": "ctxEquiv (seqComp (ret v) c) c",
      "targetModelKind": "typed-contextual-semantics",
      "writtenRef": "seq_unit"
    },
    {
      "auditLine": 39,
      "axiomTrust": "trusted",
      "axioms": [
        "Classical.choice",
        "Quot.sound",
        "propext"
      ],
      "claimKind": "forward-simulation",
      "claimRole": "canonical",
      "claimStrength": "strong",
      "definitionSource": {
        "line": 365,
        "path": "Bang/Spec.lean"
      },
      "evidenceKind": "kernel-checked-theorem",
      "guarantee": "A successful source run has a value-preserving run in the project Wasm-oriented abstract machine.",
      "id": "bang-compile-forward-sim",
      "limitations": [
        "One-way only.",
        "Does not target the concrete WAT emitter or official Wasm semantics.",
        "Excludes ambient host IO represented by literal capabilities."
      ],
      "premiseUsage": {
        "loadBearing": [
          "literal-capability freedom",
          "successful source evaluation"
        ],
        "unused": []
      },
      "reportName": "Bang.compile_forward_sim",
      "scope": "Literal-capability-free programs and terminating-success executions.",
      "specHeadline": true,
      "statementShape": "VcapFree c -> Source.eval fuel c = done v -> exists fuel', Wasmfx.run fuel' (compileC c) = some (compileV v)",
      "targetModelKind": "source-to-project-wasm-oriented-abstract-machine",
      "writtenRef": "compile_forward_sim"
    },
    {
      "auditLine": 42,
      "axiomTrust": "trusted",
      "axioms": [
        "Classical.choice",
        "Quot.sound",
        "propext"
      ],
      "claimKind": "forward-simulation",
      "claimRole": "supporting",
      "claimStrength": "strong",
      "definitionSource": {
        "line": 2794,
        "path": "Bang/Backend/Wasm.lean"
      },
      "evidenceKind": "kernel-checked-specialization",
      "guarantee": "Pure successful source runs have matching abstract-target runs.",
      "id": "bang-compile-forward-sim-pure",
      "limitations": [
        "One-way only.",
        "Does not target concrete emitted Wasm."
      ],
      "premiseUsage": {
        "loadBearing": [
          "pure-fragment premise",
          "successful source evaluation"
        ],
        "unused": []
      },
      "reportName": "Bang.compile_forward_sim_pure",
      "scope": "Pure source fragment and terminating-success executions.",
      "specHeadline": false,
      "statementShape": "Pure c -> Source.eval fuel c = done v -> exists fuel', Wasmfx.run fuel' (compileC c) = some (compileV v)",
      "targetModelKind": "source-to-project-wasm-oriented-abstract-machine",
      "writtenRef": "Bang.compile_forward_sim_pure"
    },
    {
      "auditLine": 43,
      "axiomTrust": "trusted",
      "axioms": [
        "Classical.choice",
        "Quot.sound",
        "propext"
      ],
      "claimKind": "forward-simulation",
      "claimRole": "supporting",
      "claimStrength": "strong",
      "definitionSource": {
        "line": 2782,
        "path": "Bang/Backend/Wasm.lean"
      },
      "evidenceKind": "kernel-checked-theorem",
      "guarantee": "Pure successful source evaluation is reproduced by compiled CalcVM code.",
      "id": "bang-source-eval-to-exec",
      "limitations": [
        "Does not cover non-pure programs or non-success outcomes."
      ],
      "premiseUsage": {
        "loadBearing": [
          "pure-fragment premise",
          "successful source evaluation"
        ],
        "unused": []
      },
      "reportName": "Bang.source_eval_to_exec",
      "scope": "Pure source programs with successful terminating runs.",
      "specHeadline": false,
      "statementShape": "Pure c -> Source.eval fuel c = done v -> exists F, CalcVM.exec F 0 (compile c []) [] [] = some [ret v]",
      "targetModelKind": "source-to-calcvm",
      "writtenRef": "Bang.source_eval_to_exec"
    },
    {
      "aliasOf": "compile_forward_sim",
      "auditLine": 50,
      "axiomTrust": "trusted",
      "axioms": [
        "Classical.choice",
        "Quot.sound",
        "propext"
      ],
      "claimKind": "compatibility-alias",
      "claimRole": "alias",
      "claimStrength": "alias",
      "definitionSource": {
        "line": 101,
        "path": "Bang/Backend/Rung5ProofGrade.lean"
      },
      "evidenceKind": "theorem-alias",
      "guarantee": "Named re-export of compile_forward_sim for the rung-5 census.",
      "id": "bang-rung5proofgrade-s5-effectful-forward-sim",
      "limitations": [
        "Provides no independent proof evidence."
      ],
      "premiseUsage": {
        "loadBearing": [
          "literal-capability freedom",
          "successful source evaluation"
        ],
        "unused": []
      },
      "reportName": "Bang.Rung5ProofGrade.s5_effectful_forward_sim",
      "scope": "Exactly the scope of compile_forward_sim.",
      "specHeadline": false,
      "statementShape": "Same proposition as compile_forward_sim",
      "targetModelKind": "source-to-project-wasm-oriented-abstract-machine",
      "writtenRef": "Bang.Rung5ProofGrade.s5_effectful_forward_sim"
    },
    {
      "auditLine": 51,
      "axiomTrust": "trusted",
      "axioms": [
        "Quot.sound",
        "propext"
      ],
      "claimKind": "machine-correspondence",
      "claimRole": "supporting",
      "claimStrength": "strong",
      "definitionSource": {
        "line": 110,
        "path": "Bang/Backend/Rung5ProofGrade.lean"
      },
      "evidenceKind": "kernel-checked-theorem",